{
  "$schema": "https://json-schema.org/draft/2020-12/schema",
  "title": "AsDecided viewer export v1",
  "description": "The default JSON object emitted by decided export.",
  "type": "object",
  "required": [
    "schema_version",
    "corpus",
    "artifacts",
    "relationships"
  ],
  "properties": {
    "schema_version": {
      "type": "string",
      "const": "1"
    },
    "corpus": {
      "type": "object",
      "required": [
        "name",
        "source",
        "rac_version",
        "artifact_count"
      ],
      "properties": {
        "name": {
          "type": "string"
        },
        "source": {
          "type": "string"
        },
        "rac_version": {
          "type": "string"
        },
        "artifact_count": {
          "type": "integer",
          "minimum": 0
        }
      },
      "additionalProperties": true
    },
    "artifacts": {
      "type": "array",
      "items": {
        "type": "object",
        "required": [
          "id",
          "aliases",
          "type",
          "status",
          "title",
          "path",
          "body_html"
        ],
        "properties": {
          "id": {
            "type": "string"
          },
          "aliases": {
            "type": "array",
            "items": {
              "type": "string"
            }
          },
          "type": {
            "type": "string"
          },
          "status": {
            "type": "string"
          },
          "title": {
            "type": "string"
          },
          "path": {
            "type": "string"
          },
          "body_html": {
            "type": "string"
          }
        },
        "additionalProperties": true
      }
    },
    "relationships": {
      "type": "array",
      "items": {
        "type": "object",
        "required": [
          "from",
          "to",
          "type"
        ],
        "properties": {
          "from": {
            "type": "string"
          },
          "to": {
            "type": "string"
          },
          "type": {
            "type": "string",
            "const": "relates-to"
          }
        },
        "additionalProperties": true
      }
    }
  },
  "additionalProperties": true
}
