{
  "schema_version": "1",
  "corpus": {
    "name": "ledgerline — SAMPLE DATA (fictional service)",
    "source": "asdecided/ledgerline-sample",
    "rac_version": "0.0.0-sample",
    "artifact_count": 30,
    "sample": true
  },
  "artifacts": [
    {
      "id": "RAC-YW02VDR2Z2RT",
      "aliases": [
        "adr-001",
        "adr-001-record-architecture-decisions-as-adrs"
      ],
      "type": "adr",
      "status": "Accepted",
      "title": "Record architecture decisions as ADRs",
      "path": "lore/decisions/adr-001-record-architecture-decisions-as-adrs.md",
      "body_html": "<p>Ledgerline has grown past the point where decisions survive in chat history. New engineers re-litigate settled questions because the reasoning behind the current shape of the system is not written down anywhere durable.</p>\n<p>We will record every architecturally significant decision as a numbered ADR in the repository, in typed Markdown with YAML frontmatter, reviewed through the same pull-request flow as code.</p>\n<p>Consequence: decisions are versioned with the code they govern, and superseding a decision is an explicit, reviewable act rather than silent drift.</p>"
    },
    {
      "id": "RAC-6VD81MBSCA2F",
      "aliases": [
        "adr-002",
        "adr-002-use-flask-for-the-http-layer"
      ],
      "type": "adr",
      "status": "Superseded",
      "title": "Use Flask for the HTTP layer",
      "path": "lore/decisions/adr-002-use-flask-for-the-http-layer.md",
      "body_html": "<p>The original prototype needed an HTTP layer quickly and the team knew Flask well. The service surface was three endpoints and a health check.</p>\n<p>We chose Flask with blueprints, gunicorn workers, and marshmallow for request validation.</p>\n<p>This decision was superseded by ADR-014 when the endpoint count and the cost of hand-rolled validation outgrew the framework. The migration notes live with ADR-014.</p>"
    },
    {
      "id": "RAC-S02J1C9WRCEH",
      "aliases": [
        "adr-003",
        "adr-003-postgresql-as-the-primary-datastore"
      ],
      "type": "adr",
      "status": "Accepted",
      "title": "PostgreSQL as the primary datastore",
      "path": "lore/decisions/adr-003-postgresql-as-the-primary-datastore.md",
      "body_html": "<p>Ledgerline is a ledger: correctness under concurrent writes matters more than write throughput. We evaluated PostgreSQL, MySQL and DynamoDB against our consistency and reporting requirements.</p>\n<p>PostgreSQL wins on transactional semantics, mature tooling, and the team’s operational experience. Serializable isolation is available where the ledger invariants demand it.</p>\n<p>All durable state lives in a single PostgreSQL cluster until measurement, not intuition, proves we need otherwise. Reporting load is addressed separately in ADR-023.</p>"
    },
    {
      "id": "RAC-T9J5YN2V5EP8",
      "aliases": [
        "adr-004",
        "adr-004-schema-migrations-with-alembic"
      ],
      "type": "adr",
      "status": "Accepted",
      "title": "Schema migrations with Alembic",
      "path": "lore/decisions/adr-004-schema-migrations-with-alembic.md",
      "body_html": "<p>Schema changes were being applied by hand against staging and production, and the two had drifted. We need migrations that are ordered, reviewable and reversible.</p>\n<p>We adopt Alembic, with one migration per pull request and a CI check that the migration history applies cleanly to an empty database. Autogenerate output is a starting point, never committed unreviewed.</p>\n<p>Destructive migrations (drops, type narrowing) require a two-step expand/contract sequence across releases, so deploys stay backwards compatible per ADR-028.</p>"
    },
    {
      "id": "RAC-Y3FE4XMV5C14",
      "aliases": [
        "adr-005",
        "adr-005-celery-with-a-redis-broker-for-background-work"
      ],
      "type": "adr",
      "status": "Superseded",
      "title": "Celery with a Redis broker for background work",
      "path": "lore/decisions/adr-005-celery-with-a-redis-broker-for-background-work.md",
      "body_html": "<p>Invoice generation and webhook delivery are too slow for the request path. We need a task queue.</p>\n<p>We chose Celery with Redis as the broker, since Redis was already deployed for caching (ADR-006) and Celery was the de facto standard for Python at the time.</p>\n<p>In practice Celery’s configuration surface and prefork worker model caused recurring operational pain. Superseded by ADR-021, which records the move to Dramatiq.</p>"
    },
    {
      "id": "RAC-BKQF8PWYREH0",
      "aliases": [
        "adr-006",
        "adr-006-redis-caching-with-explicit-ttls-only"
      ],
      "type": "adr",
      "status": "Accepted",
      "title": "Redis caching with explicit TTLs only",
      "path": "lore/decisions/adr-006-redis-caching-with-explicit-ttls-only.md",
      "body_html": "<p>Tariff lookups and customer entitlement checks dominate read load and change rarely. A cache is justified; an incoherent cache in a billing system is not.</p>\n<p>We cache in Redis with an explicit TTL on every key and no cache-invalidation-by-event anywhere. If a value cannot tolerate being stale for its TTL, it must not be cached.</p>\n<p>Keys follow the pattern documented in STD-002, and every cached read path must degrade correctly when Redis is unavailable: the cache is an optimisation, never a source of truth.</p>"
    },
    {
      "id": "RAC-49R5AMBEQPAJ",
      "aliases": [
        "adr-007",
        "adr-007-authenticate-via-oidc-against-the-corporate-idp"
      ],
      "type": "adr",
      "status": "Accepted",
      "title": "Authenticate via OIDC against the corporate IdP",
      "path": "lore/decisions/adr-007-authenticate-via-oidc-against-the-corporate-idp.md",
      "body_html": "<p>Ledgerline must not own passwords. Operators authenticate with their corporate identity; service-to-service callers use workload identities.</p>\n<p>Human sessions use the OIDC authorization-code flow against the corporate identity provider. Machine callers present short-lived JWTs minted by the platform’s workload identity service; we validate issuer, audience and expiry on every request.</p>\n<p>No local user table, no API keys in headers, no long-lived shared secrets. Authorization is a separate concern, recorded in ADR-008.</p>"
    },
    {
      "id": "RAC-G54WT38ZFVXG",
      "aliases": [
        "adr-008",
        "adr-008-role-based-authorization-enforced-in-the-service-layer"
      ],
      "type": "adr",
      "status": "Accepted",
      "title": "Role-based authorization enforced in the service layer",
      "path": "lore/decisions/adr-008-role-based-authorization-enforced-in-the-service-layer.md",
      "body_html": "<p>With authentication settled in ADR-007, we need a consistent answer for what a caller may do. Endpoint-by-endpoint ad hoc checks have already produced one near-miss.</p>\n<p>Authorization is role-based, evaluated in the service layer rather than in HTTP handlers, so the same rules govern the API, background tasks and the admin CLI. Roles are declared in code; assignments live in the database.</p>\n<p>Every privileged operation must name its required role explicitly. A missing declaration fails closed and fails loudly in CI.</p>"
    },
    {
      "id": "RAC-ZMK1H2MB957J",
      "aliases": [
        "adr-009",
        "adr-009-structured-logging-with-structlog"
      ],
      "type": "adr",
      "status": "Accepted",
      "title": "Structured logging with structlog",
      "path": "lore/decisions/adr-009-structured-logging-with-structlog.md",
      "body_html": "<p>Grepping interleaved free-text logs across gunicorn workers does not survive contact with a real incident.</p>\n<p>All logs are structured key-value events emitted through structlog, JSON-rendered in production, with request_id and customer_id bound automatically at the edge of every request and task.</p>\n<p>Log messages are lowercase event names, not sentences; context goes in fields. Nothing sensitive (PANs, tokens, raw payloads) may be logged — enforced by a processor that redacts known field names.</p>"
    },
    {
      "id": "RAC-M2DRS9ENQXFW",
      "aliases": [
        "adr-010",
        "adr-010-prometheus-metrics-grafana-dashboards"
      ],
      "type": "adr",
      "status": "Accepted",
      "title": "Prometheus metrics, Grafana dashboards",
      "path": "lore/decisions/adr-010-prometheus-metrics-grafana-dashboards.md",
      "body_html": "<p>We need quantitative answers to \"is it slow\" and \"is it failing\" that do not require reading logs (ADR-009).</p>\n<p>The service exposes Prometheus metrics: RED metrics per endpoint and per task type, plus domain counters such as invoices_issued_total. Dashboards live in Grafana, provisioned from JSON in this repository.</p>\n<p>Every alert must page on symptoms (error rate, latency, queue age), not causes. Cause-level metrics exist for diagnosis, not alerting.</p>"
    },
    {
      "id": "RAC-VKB9F8FSMWD0",
      "aliases": [
        "adr-011",
        "adr-011-distributed-tracing-with-opentelemetry"
      ],
      "type": "adr",
      "status": "Accepted",
      "title": "Distributed tracing with OpenTelemetry",
      "path": "lore/decisions/adr-011-distributed-tracing-with-opentelemetry.md",
      "body_html": "<p>A single invoice touches the API, two background tasks and three external calls. Logs (ADR-009) and metrics (ADR-010) tell us something is slow; they do not tell us where.</p>\n<p>We instrument with OpenTelemetry, propagating W3C trace context across HTTP calls and through the task queue, and export to the platform’s collector. Sampling is head-based at 10% with errors always sampled.</p>\n<p>Spans are added at service boundaries and around external calls only; we do not trace every function. Trace IDs are bound into log events so logs, metrics and traces cross-reference.</p>"
    },
    {
      "id": "RAC-NCJFPY5TG4HP",
      "aliases": [